English Question,Tamil Question,Tamil Answer
,தொழிற்பெயர் என்றால் என்ன?," தொழிற்பெயர்
ஒரு செயலை உணர்த்தும் பெயர் தொழிற்பெயர்.=
(எ-டு) ஆடுதல், பயிற்சி, வருகை, ஓட்டம்."
,பெயர்ச் சோலை சுருக்கமாக விளக்கவும்?," பெயர்ச்சொல்
ஒன்றின் பெயரைக் குறிப்பது பெயர்ச்சொல் ஆகும். பெயர்ச்சொல்லில் பல வகை உண்டு. பொதுவாக அதனை அறுவகைப் பெயர்கள் எனக் குறிப்பர். வேற்றுமைகளை ஏற்கும்; காலம் காட்டாது."
,பெயர் சோலின் சில உதாரணங்கள் என்ன?," பெயர் சோலின் சில எடுத்துக்காட்டுகள் பொருட்பெயர், இடப்பெயர், காலப்பெயர், சினைப்பெயர், பண்புப்பெயர், தொழிற்பெயர் ஆகியவை அடங்கும்."
,சில பொருட்பெயர் உதாரணங்கள் என்ன?," மாடு - உயிருள்ள பொருட்பெயர், கல் - உயிரில்லாப் பொருட்பெயர், காற்று - உருவமில்லாப் பொருட்பெயர்
."
,சில இடப்பெயர் உதாரணங்கள் என்ன?,"  இடப்பெயர்களின் சில உதாரணங்கள் அடங்கும் சிங்கப்பூர், நீச்சல் குளம், மருத்துவமனை."
,சில காலப்பெயர் உதாரணங்கள் என்ன?," காலப்பெயர் உதாரணங்கள் அடங்கும் நாள், நாழிகை, நொடி போன்றவை
அசுவினி, பரணி போன்றவை.
மேழம், விடை (சித்திரை, வைகாசி) போன்றவை."
,சில சினைப்பெயர் உதாரணங்கள் என்ன?,"  சினைப்பெயர் சில உதாரணங்கள் அடங்கும் கை, கண், கிளை, இலை."
,தமிழ் எழுத்துக்களில் எத்தனை உயிரெழுத்துக்கள் உள்ளன?,தமிழ் எழுத்துக்களில் பன்னிரண்டு உயிரெழுத்துக்கள் உள்ளன.
,தமிழ் எழுத்துக்களில் எத்தனை குறுகிய உயிரெழுத்துக்கள் உள்ளன?,தமிழ் எழுத்துக்களில் ஐந்து குறுகிய உயிரெழுத்துக்கள் உள்ளன.
,தமிழ் எழுத்துக்களில் உள்ள ஐந்து குறுகிய உயிரெழுத்துக்கள் யாவை?,"  அ, இ, உ, எ, மற்றும் ஒ ஆகியவை தமிழ் எழுத்துக்களில் உள்ள ஐந்து குறுகிய உயிரெழுத்துக்கள்."
,தமிழ் எழுத்துக்களில் எத்தனை நீண்ட உயிரெழுத்துக்கள் உள்ளன?,தமிழ் எழுத்துக்களில் ஐந்து நீண்ட உயிரெழுத்துக்கள் உள்ளன.
,தமிழ் எழுத்துக்களில் உள்ள ஐந்து நீண்ட உயிரெழுத்துக்கள் யாவை?,"  ஆ, ஈ, ஈ, ஏ, மற்றும் ஓ ஆகியவை தமிழ் எழுத்துக்களில் உள்ள ஐந்து நீண்ட உயிரெழுத்துக்கள்"
,தமிழ் எழுத்துக்களில் எத்தனை மெய் உள்ளன?,தமிழ் எழுத்துக்களில் பதினெட்டு மெய் உள்ளது.
,தமிழ் எழுத்துக்களில் எத்தனை உயிர்மெய் எழுத்துகள் உள்ளன?,தமிழ் எழுத்துக்களில் 216 உயிர்மெய் எழுத்துக்கள் உள்ளன.
,தமிழ் எழுத்துக்களில் உயிர்மெய் எழுத்துக்களின் சில எடுத்துக்காட்டுகளை நீங்கள் கொடுக்க முடியுமா?,"  க, கி, கோ, கை, மெ, பு, ச, ரி, ட."
,தமிழ் எழுத்துக்களில் மொத்தம் எத்தனை எழுத்துக்கள் உள்ளன?,தமிழ் எழுத்துக்களில் மொத்தம் 247 எழுத்துக்கள் உள்ளன.
,"தமிழ் எழுத்துக்களில் உள்ள மெய் எழுத்துக்கள் அனைத்தையும் பட்டியலிடுங்கள். க், ங், ச், ஞ், ட், ண், த், ந், ப், ம், ய், ர், ல், வ், ழ், ள், ற், மற்றும் ன்.?",
,இலை என்ற வார்த்தையில் உள்ள உயிரெழுத்து எது?,இலை என்ற வார்த்தையில் இருக்கும் ஒரே உயிரெழுத்து 'இ'.
,விசிறி என்ற வார்த்தையில் என்ன உயிரெழுத்துக்கள் உள்ளன?,விசிறி என்ற வார்த்தையில் உயிரெழுத்துக்கள் இல்லை.
,ஒட்டகம் என்ற வார்த்தையில் எந்த உயிரெழுத்து உள்ளது?,ஒட்டகம் என்ற வார்த்தையில் இருக்கும் ஒரே உயிரெழுத்து 'ஒ'.
,சர்க்கரை என்ற வார்த்தையில் என்ன உயிரெழுத்துக்கள் உள்ளன?,சர்க்கரை என்ற வார்த்தையில் உயிரெழுத்துக்கள் எதுவும் இல்லை
,அப்பா என்ற வார்த்தையில் என்ன மெய் எழுத்துக்கள் உள்ளன?,ப்' மட்டுமே அப்பா என்ற வார்த்தையில் உள்ள மெய் எழுத்து.
,ஒட்டகம் என்ற வார்த்தையில் என்ன மெய் எழுத்துக்கள் உள்ளன?,ட்' மற்றும் 'ம்' இரண்டும் ஒட்டகம் என்ற வார்த்தையில் உள்ள மெய் எழுத்துக்கள்.
,மாடு என்ற வார்த்தையில் என்ன மெய் எழுத்துக்கள் உள்ளன?,மாடு என்ற வார்த்தையில் மெய் எழுத்துக்கள் எதுவும் இல்லை.
,நாற்காலி என்ற வார்த்தையில் என்ன உயிர்மெய் எழுத்துக்கள் உள்ளது?,"  'நா', 'கா', மற்றும் 'லி' ஆகியவை நாற்காலி என்ற வார்த்தையில் உள்ள உயிர்மெய் எழுத்துக்கள்."
,கணினி என்ற வார்த்தையில் உள்ள உயிர்மெய் எழுத்துக்கள் யாவை?,ணி' மற்றும் 'னி' ஆகியவை கணினி என்ற வார்த்தையில் உள்ள உயிர்மெய் எழுத்துக்கள்.
,ஆம் என்ற வார்த்தையில் எத்தனை உயிர்மெய் எழுத்துக்கள் உள்ளன?,ஆம் என்ற வார்த்தையில் எதுவும் உயிர்மெய் எழுத்துக்கள் இல்லை.
,கணிதம் என்ற வார்த்தையில் என்ன மெய் எழுத்துக்கள் உள்ளன?,கணிதம் என்ற வார்த்தையில் உள்ள ஒரே மெய் எழுத்து 'ம்'.
,அரங்கம் என்ற வார்த்தையில் என்ன உயிரெழுத்துக்கள் உள்ளன?,அரங்கம் என்ற வார்த்தையில் உள்ள ஒரே உயிரெழுத்து 'அ'.
,இமை என்ற வார்த்தையில் என்ன உயிரெழுத்துக்கள் உள்ளன?,இமை என்ற வார்த்தையில் உள்ள ஒரே உயிரெழுத்து 'இ'.
,உண்மை என்ற வார்த்தையில் என்ன உயிரெழுத்துக்கள் உள்ளன?,உண்மை என்ற வார்த்தையில் உள்ள ஒரே உயிரெழுத்து 'உ'.
,ஆமை என்ற வார்த்தையில் என்ன உயிரெழுத்துக்கள் உள்ளன?,ஆமை என்ற வார்த்தையில் இருக்கும் ஒரே உயிரெழுத்து 'ஆ'.
,ஆண்டு' என்ற வார்த்தையில் என்ன உயிரெழுத்துக்கள் உள்ளன?,ஆ' என்பது 'ஆண்டு' என்ற வார்த்தையில் இருக்கும் ஒரே உயிரெழுத்து.
,குருவி' என்ற வார்த்தையில் என்ன உயிரெழுத்துக்கள் உள்ளன?,குருவி என்ற வார்த்தையில் உயிரெழுத்துக்கள் இல்லை.
,புத்தகம்' என்ற வார்த்தையில் என்ன உயிரெழுத்துக்கள் உள்ளன?,புத்தகம்' என்ற வார்த்தையில் உயிரெழுத்துக்கள் இல்லை.
,சட்டை' என்ற வார்த்தையில் என்ன உயிரெழுத்துக்கள் உள்ளன?,சட்டை' என்ற வார்த்தையில் உயிரெழுத்துக்கள் இல்லை.
,சந்தை' என்ற வார்த்தையில் என்ன மெய் உள்ளன?,சந்தை' என்ற வார்த்தையில் 'ந்' மட்டுமே மெய்எழுத்து
,நண்டு' என்ற வார்த்தையில் என்ன மெய் உள்ளன?,ண்' என்ற வார்த்தையில் 'ண்' மட்டுமே மெய்எழுத்து
,முடிச்சு' என்ற வார்த்தையில் என்ன மெய் உள்ளன?,முடிச்சு' என்ற வார்த்தையில் 'ச்' மட்டுமே மெய் உள்ளது.
,ஆடு' என்ற வார்த்தையில் என்ன மெய் எழுத்துக்கள் உள்ளன?,ஆடு' என்ற வார்த்தையில் மெய் எழுத்துக்கள் எதுவும் இல்லை.
,கதவு' என்ற வார்த்தையில் என்ன மெய் எழுத்துக்கள் உள்ளன?,கதவு' என்ற வார்த்தையில் மெய் எழுத்துக்கள் எதுவும் இல்லை.
,ஒலி' என்ற வார்த்தையில் என்ன மெய் உள்ளன?,ஒலி' என்ற வார்த்தையில் மெய் எழுத்துக்கள் எதுவும் இல்லை.
,ஒளி' என்ற வார்த்தையில் என்ன மெய் எழுத்துக்கள் உள்ளன?,ஒளி' என்ற வார்த்தையில் மெய் எழுத்துக்கள் எதுவும் இல்லை.
,புலி என்ற வார்த்தையில் எத்தனை உயிர்மெய் எழுத்துக்கள் உள்ளன?,புலி என்ற வார்த்தையில் உள்ள உயிர்மெய் எழுத்துக்கள் 'பு' மற்றும் 'லி'.
,நரி' என்ற வார்த்தையில் என்ன உயிர்மெய் எழுத்துகள் உள்ளன?,நரி என்ற வார்த்தையில் உள்ள உயிர்மெய் எழுத்துக்கள் 'ந' மற்றும் 'ரி'.
,சில பொதுவான உறவுகள் தமிழ் என்றால் என்ன?," இங்கே சில பொதுவான உறவுகள்: 'தாய்'-'தந்தை', 'மனைவி'-'கணவர்', 'சகோதரர்'-'சகோதரி', 'மாமா'-'மருமகன்', மற்றும் 'பாட்டி'-'தாத்தா'."
,சில உதாரணம் பெண் பாலின சொற்கள் யாவை?," நிச்சயமாக! இங்கே சில எடுத்துக்காட்டுகள்: 'அவள் சாப்பிட்டாள்', 'அவள் வேலை செய்தாள்', மற்றும் 'அவள் நடந்தாள்'."
,சில ஆண் பாலின சொற்கள் யாவை?," இங்கே சில எடுத்துக்காட்டுகள்: 'சிறுவன் சாப்பிட்டான்', 'பையன் பேசினான்', மற்றும் 'சிறுவன் பயணம்'."
,ஆண் பாலின பெயர்கள் என்ன?," எடுத்துக்காட்டு பெயர்கள்: 'கண்ணன்', 'குமார்', மற்றும் 'அனந்த்'"
,சில உதாரணம் பெண் பாலின சொற்கள் யாவை?," இங்கே சில எடுத்துக்காட்டுகள்: 'கயல்', 'யமுனா', மற்றும் 'கமலா'"
,தமிழில் கடந்த காலம் என்ன?,கடந்த காலம் உருவாக்கப்பட்ட நடப்புகள் அல்லது நிகழ்வுகளை குறிக்கின்றன.
,தமிழில் கடந்த காலத்திற்குள் சென்ற நாட்கம் என்ன?,தமிழில் கடந்த காலத்திற்குள் சென்ற நாட்கம் என்ன
,தமிழில் பின்னர் நடந்த காலம் என்ன?,பின்னர் நடந்த காலம் அந்த காலத்தின் பின்னர் நடந்த நிகழ்வுகளை விளக்குகின்றது.
,தமிழில் கடந்த நேரம் என்ன?,கடந்த நேரம் உருவாக்கப்பட்ட நிகழ்வுகளை குறிக்கின்றது.
,தமிழில் எதிர்மறை காலங்கள் என்ன?,"  தமிழில் எதிர்மறை காலங்கள் இந்தியர் காலம், நிகழ் காலம், மெல்லிய நிகழ் காலம் ஆகியவை உள்ளன."
,தமிழில் எதிர்மறை காலத்திற்குள் எப்படி பயன்படுத்துவது?," தமிழில் எதிர்மறை காலத்திற்குள் படைக்கப்பட்ட நடப்புகள், காரியங்கள் மற்றும் நிகழ்வுகளை குறிப்பிடுகின்றன."
,தமிழில் காலத்திற்குள் முன்காலம் என்ன?,முன்காலம் காலத்திற்குள் அதிகமான நடப்புகள் மற்றும் நிகழ்வுகளை விளக்குகின்றன.முன்காலம் காலத்திற்குள் அதிகமான நடப்புகள் மற்றும் நிகழ்வுகளை விளக்குகின்றன.
,தமிழில் எவையெல்லாம் இன்னும் காலம் என்ன?,இன்னும் காலம் முன்காலம் மற்றும் நிகழ் காலம் ஆகின்றன.
,தமிழில் முன்காலத்திற்குள் இருக்கும் காலங்கள் என்ன?,முன்காலத்திற்குள் உள்ள காலங்கள் கடந்த நேரத்தில் நடந்த நிகழ்வுகளை குறிக்கின்றன.
,தமிழில் பின்னர்காலத்திற்குள் எத்திர்காலம் என்ன?,பின்னர்காலம் காலத்திற்குள் அந்தக் காலத்தின் பின்னர் நடந்த நிகழ்வுகளை குறிக்கின்றன.
,தமிழில் எதிர்காலம் என்ன?,எதிர்காலம் அத்தியாயங்கள் மற்றும் நிகழ்வுகள் முன்னோடிக் கொண்டு வந்தது பின்பு நீடித்து நோக்கம் செய்யப்படுகின்றன.
,தமிழில் முன்காலத்திற்குள் படைப்பான காலம் என்ன?,முன்காலத்திற்குள் படைக்கப்பட்ட காலம் அந்தக் காலத்தின் பின்னர் நடந்த நிகழ்வுகளை விளக்குகின்றது.
,தமிழில் முன்காலத்திற்குள் சென்ற காலம் என்ன?,முன்காலத்திற்குள் சென்ற காலம் அந்த காலத்தின் பின்னர் நடந்த நிகழ்வுகளை விளக்குகின்றது.
,தமிழில் எதிர்காலத்திற்குள் வந்த காலம் என்ன?,எதிர்காலத்திற்குள் வந்த காலம் அந்த காலத்தின் பின்னர் நடந்த நிகழ்வுகளை விளக்குகின்றது.
,தமிழில் எதிர்காலத்திற்குள் போன காலம் என்ன?,எதிர்காலத்திற்குள் போன காலம் அந்த காலத்தின் பின்னர் நடந்த நிகழ்வுகளை விளக்குகின்றது.
,தமிழில் வினை என்றால் என்ன?,தமிழில் வினை ஒரு சொல்லின் செயல்முறையை குறிப்பிடுகின்றது. இது நிகழ்வுகளை குறிக்கும் அல்லது நிகழ்ந்த செயல்களை விளக்குகின்றது.
,தமிழில் பண்புப் பெயர் என்றால் என்ன?,தமிழில் பண்புப் பெயர் ஒரு பெயர் அல்லது படைச்சொல்லை விவரிக்கும் பொருள் அல்லது அதன் குறிப்புகளை அழுத்துகின்றது.
,தமிழில் பண்புப் படைச்சொல் என்றால் என்ன?,மிழில் பண்புப் படைச்சொல் மூலம் மொழியை அல்லது அதன் பண்புகளை விவரிக்கும் சொல் அல்லது சொல்லுக்கு அணுகல்முறையை குறிப்பிடுகின்றது.
,தமிழில் இணைப்புச் சொல் என்றால் என்ன?,தமிழில் இணைப்புச் சொல் ஒரு சொல்லின் பின்னணிகளை இணைக்கும் சொல் அல்லது அவற்றின் பின்னணிகளை விளக்குகின்றது.
,தமிழில் விபரீத சொல் என்றால் என்ன?,தமிழில் விபரீத சொல் ஒரு குறிப்புகள் அல்லது உரிமைகளை விவரிக்கும் சொல் அல்லது அதன் குறிப்புகளை அழுத்துகின்றது.
,தமிழில் பெயர் என்றால் என்ன?," தமிழில் பெயர் ஒரு சொல் அல்லது பெயராகும் பொருளை அல்லது கடினம், பொருள் அல்லது கருவி குறிப்பிடுகின்றது."
,தமிழில் படைச்சொல் என்றால் என்ன?,தமிழில் படைச்சொல் மூலம் மொழிக்கும் அல்லது அதன் செயல்முறையைக் குறிப்பிடுகின்ற சொல் அல்லது சொல்லுக்கு அணுகல்முறையை குறிப்பிடுகின்றது.
,தமிழில் பண்புப் படைச்சொல் என்றால் என்ன?,மிழில் பண்புப் படைச்சொல் மூலம் மொழியை அல்லது அதன் பண்புகளை விவரிக்கும் சொல் அல்லது சொல்லுக்கு அணுகல்முறையை குறிப்பிடுகின்றது. தமிழில் பண்புப் படைச்சொல் மூலம் மொழியை அல்லது அதன் பண்புகளை விவரிக்கும் சொல் அல்லது சொல்லுக்கு அணுகல்முறையை குறிப்பிடுகின்றது.
,தமிழில் படைச்சொல் என்றால் என்ன?,தமிழில் படைச்சொல் ஒரு சொல்லின் பின்னணிகளை இணைக்கும் சொல் அல்லது அவற்றின் பின்னணிகளை விளக்குகின்றது.
,ஓடு வினை சொல் ஆகுமா?," ஆம், 'ஓடு' ஒரு வினை சொல் ஆகும்."
,படித்தான்' ஒரு வினை சொல் ஆகுமா?," ஆம், 'படித்தான்' ஒரு வினை சொல் ஆகுமா."
,புதிய' ஒரு வினை சொல் ஆகுமா?," இல்லை, 'புதிய' ஒரு வினை சொல் ஆகுமா."
,நேரம்' ஒரு வினை சொல் ஆகுமா?," இல்லை, 'நேரம்' ஒரு வினை சொல் ஆகுமா."
,பாடு' ஒரு வினை சொல் ஆகுமா?," ஆம், 'பாடு' ஒரு வினை சொல் ஆகுமா."
